{
  "schema_version": 1,
  "kind": "research_round",
  "round_id": "l4g1_mixed_v1",
  "campaign_id": "sfm_stream_001",
  "status": "frozen",
  "counts": {"batch_count": 4, "candidate_count": 16, "control_count": 48},
  "batch_ids": ["l4_formal_history_next_v1_book_imbalance", "l4_formal_history_next_v1_flow_pressure", "l4_formal_history_next_v1_impact_efficiency", "l4_formal_history_next_v1_liquidity_resilience"],
  "candidate_ids": ["book_imbalance_l4g1_param_a", "book_imbalance_l4g1_param_b", "book_imbalance_l4g1_mechanism_a", "book_imbalance_l4g1_mechanism_b", "flow_pressure_l4g1_param_a", "flow_pressure_l4g1_param_b", "flow_pressure_l4g1_mechanism_a", "flow_pressure_l4g1_mechanism_b", "impact_efficiency_l4g1_param_a", "impact_efficiency_l4g1_param_b", "impact_efficiency_l4g1_mechanism_a", "impact_efficiency_l4g1_mechanism_b", "liquidity_resilience_l4g1_param_a", "liquidity_resilience_l4g1_param_b", "liquidity_resilience_l4g1_mechanism_a", "liquidity_resilience_l4g1_mechanism_b"],
  "parent_candidate_ids": [
    "book_imbalance_microprice_displacement_w16_v1_lag1", "book_imbalance_microprice_displacement_w32_v0_lag1", "book_imbalance_microprice_displacement_w64_v3_lag1", "book_imbalance_microprice_displacement_w128_v2_lag1", "book_imbalance_spread_conditioned_imbalance_w16_v2_lag2", "book_imbalance_spread_conditioned_imbalance_w32_v1_lag2", "book_imbalance_spread_conditioned_imbalance_w64_v0_lag2", "book_imbalance_spread_conditioned_imbalance_w128_v3_lag2", "book_imbalance_weighted_depth_imbalance_w16_v0_lag0", "book_imbalance_weighted_depth_imbalance_w32_v3_lag0", "book_imbalance_weighted_depth_imbalance_w64_v2_lag0", "book_imbalance_weighted_depth_imbalance_w128_v1_lag0",
    "flow_pressure_decayed_trade_flow_w16_lag0", "flow_pressure_decayed_trade_flow_w32_lag0", "flow_pressure_decayed_trade_flow_w64_lag1", "flow_pressure_decayed_trade_flow_w128_lag2", "flow_pressure_signed_trade_flow_w16", "flow_pressure_signed_trade_flow_w32_lag0", "flow_pressure_signed_trade_flow_w64_lag1", "flow_pressure_signed_trade_flow_w128_lag2", "flow_pressure_trade_flow_zscore_w16_lag0", "flow_pressure_trade_flow_zscore_w32_lag0", "flow_pressure_trade_flow_zscore_w64_lag1", "flow_pressure_trade_flow_zscore_w128_lag2",
    "impact_efficiency_mid_price_response_w16", "impact_efficiency_mid_price_response_w32", "impact_efficiency_mid_price_response_w64", "impact_efficiency_mid_price_response_w128", "impact_efficiency_signed_price_impact_w16", "impact_efficiency_signed_price_impact_w32", "impact_efficiency_signed_price_impact_w64", "impact_efficiency_signed_price_impact_w128", "impact_efficiency_ofi_response_w16", "impact_efficiency_ofi_response_w32", "impact_efficiency_absorption_divergence_w16", "impact_efficiency_absorption_divergence_w32",
    "liquidity_resilience_multi_level_depth_recovery_w16_lag0", "liquidity_resilience_multi_level_depth_recovery_w32_lag0", "liquidity_resilience_multi_level_depth_recovery_w64_lag1", "liquidity_resilience_multi_level_depth_recovery_w128_lag2", "liquidity_resilience_shock_recovery_speed_w16_lag0", "liquidity_resilience_shock_recovery_speed_w32_lag0", "liquidity_resilience_shock_recovery_speed_w64_lag1", "liquidity_resilience_shock_recovery_speed_w128_lag2", "liquidity_resilience_spread_adjusted_depth_recovery_w16", "liquidity_resilience_spread_adjusted_depth_recovery_w32_lag0", "liquidity_resilience_spread_adjusted_depth_recovery_w64_lag1", "liquidity_resilience_spread_adjusted_depth_recovery_w128_lag2"
  ],
  "parent_portrait_ids": ["book_imbalance_portrait_01", "book_imbalance_portrait_02", "book_imbalance_portrait_03", "book_imbalance_portrait_04", "book_imbalance_portrait_05", "book_imbalance_portrait_06", "book_imbalance_portrait_07", "book_imbalance_portrait_08", "book_imbalance_portrait_09", "book_imbalance_portrait_10", "book_imbalance_portrait_11", "book_imbalance_portrait_12", "flow_pressure_portrait_01", "flow_pressure_portrait_02", "flow_pressure_portrait_03", "flow_pressure_portrait_04", "flow_pressure_portrait_05", "flow_pressure_portrait_06", "flow_pressure_portrait_07", "flow_pressure_portrait_08", "flow_pressure_portrait_09", "flow_pressure_portrait_10", "flow_pressure_portrait_11", "flow_pressure_portrait_12", "impact_efficiency_portrait_01", "impact_efficiency_portrait_02", "impact_efficiency_portrait_03", "impact_efficiency_portrait_04", "impact_efficiency_portrait_05", "impact_efficiency_portrait_06", "impact_efficiency_portrait_07", "impact_efficiency_portrait_08", "impact_efficiency_portrait_09", "impact_efficiency_portrait_10", "impact_efficiency_portrait_11", "impact_efficiency_portrait_12", "liquidity_resilience_portrait_01", "liquidity_resilience_portrait_02", "liquidity_resilience_portrait_03", "liquidity_resilience_portrait_04", "liquidity_resilience_portrait_05", "liquidity_resilience_portrait_06", "liquidity_resilience_portrait_07", "liquidity_resilience_portrait_08", "liquidity_resilience_portrait_09", "liquidity_resilience_portrait_10", "liquidity_resilience_portrait_11", "liquidity_resilience_portrait_12"],
  "stages": ["L2", "L3", "L4", "L6-display"],
  "stages_readable_splits": {"L2": ["training", "observation"], "L3": ["training", "observation"], "L4": ["training", "observation"], "L6-display": ["holdout"]},
  "events": [92600000, 100000000, 103000000, 110000000, 113000000, 133000000, 140000000, 143000000],
  "universes": ["000906", "003800", "000985"],
  "labels": ["raw926", "ease926"],
  "date_lists": {
    "training": {"path": "campaigns/sfm_stream_001/manifests/formal-history-production-dates-v2.txt", "sha256": "sha256:4dcbe56f13aa2d3318d48af2e27c47beed322aa4a45b20128f52cc40520ac8e9", "date_start": "20210104", "date_end": "20241231", "purpose": "L4 training and frozen selection evidence"},
    "observation": {"path": "campaigns/sfm_stream_001/manifests/formal-history-production-dates-v2.txt", "sha256": "sha256:4dcbe56f13aa2d3318d48af2e27c47beed322aa4a45b20128f52cc40520ac8e9", "date_start": "20210104", "date_end": "20241231", "purpose": "post-training observation within the 2021-2024 selection boundary"},
    "holdout": {"path": "campaigns/sfm_stream_001/manifests/formal-history-holdout-dates-v2.txt", "sha256": "sha256:5c3b8a4422b462a8b8398f5d3a9a2252dbb76394a45b20128f52cc40520ac8e9", "date_start": "20250102", "date_end": "20251210", "purpose": "sealed L6 display only after selection and best-event freeze"}
  },
  "families": {
    "book_imbalance": {"research_question": "Does spread conditioning or microprice displacement stabilize order-book imbalance?", "single_variable_control": "Change only window/depth or the named spread/microprice mechanism against the parent.", "parent_candidate_ids": ["book_imbalance_microprice_displacement_w16_v1_lag1", "book_imbalance_microprice_displacement_w32_v0_lag1", "book_imbalance_microprice_displacement_w64_v3_lag1", "book_imbalance_microprice_displacement_w128_v2_lag1", "book_imbalance_spread_conditioned_imbalance_w16_v2_lag2", "book_imbalance_spread_conditioned_imbalance_w32_v1_lag2", "book_imbalance_spread_conditioned_imbalance_w64_v0_lag2", "book_imbalance_spread_conditioned_imbalance_w128_v3_lag2", "book_imbalance_weighted_depth_imbalance_w16_v0_lag0", "book_imbalance_weighted_depth_imbalance_w32_v3_lag0", "book_imbalance_weighted_depth_imbalance_w64_v2_lag0", "book_imbalance_weighted_depth_imbalance_w128_v1_lag0"], "expected_supported_events": [100000000, 103000000, 110000000, 113000000, 133000000, 140000000, 143000000], "hypothesis": "State-conditioned depth imbalance carries more stable signed information than unconditional depth.", "success_condition": "Training and observation agree in raw-signed direction on at least one expected event with adequate coverage and no parent contradiction.", "rejection_condition": "Technical evidence is complete but the pre-registered mechanism is not replicated or does not improve its parent.", "stop_condition": "Missing parent portrait, lookahead, denominator drift, or shared quote-data failure stops the family and round.", "judgement_rules": {"supported": "training and observation direction agree with stable IC/LS and coverage", "promising": "consistent signal exists but one split, universe, label, or metric is incomplete", "unsupported": "evaluable without replication or incremental support", "not_evaluable": "not_ready, insufficient coverage, or undefined metric", "error": "data, schema, finite-value, timing, or denominator error"}},